{
  "$schema": "https://json-schema.org/draft/2020-12/schema",
  "$id": "https://kicad-agent.local/schemas/scenario.v0.schema.json",
  "title": "Simulation Scenario (v0)",
  "description": "One operating point of a schematic: declared power-rail voltages, rail-class mappings that pin down the meaning of `follows_rail` symbols from component specs, and expected node voltages the checker will verify. Consumed by sim_harness/dc_op_check.py (Layer 3a).",
  "type": "object",
  "required": ["spec_version", "name", "power_rails"],
  "additionalProperties": false,
  "properties": {
    "spec_version": {
      "const": "0",
      "description": "Scenario schema major version."
    },
    "name": {
      "type": "string",
      "description": "Short slug used in reports. E.g., 'full_pack_20v_usb'."
    },
    "description": {
      "type": "string"
    },
    "power_rails": {
      "type": "object",
      "additionalProperties": {
        "type": "number",
        "description": "Voltage in volts relative to GND."
      },
      "description": "Map of net name → voltage in volts. Each declared rail becomes an ideal SPICE voltage source in the DC deck. Includes regulated outputs the ICs are supposed to be holding (VOUT_12V, REGOUT, etc.) — the point of Layer 3a is not to solve for those but to verify the surrounding network is consistent with them."
    },
    "rail_class_map": {
      "type": "object",
      "additionalProperties": {
        "type": "string",
        "description": "The schematic net name this class maps to."
      },
      "description": "Maps `follows_rail` symbols in component specs (e.g., 'OUTPUT', 'INPUT_SUPPLY') to the actual net names in this schematic. If unset or the class isn't found here, pins that reference the class fall back to `high_z`."
    },
    "expected": {
      "type": "object",
      "additionalProperties": {
        "$ref": "#/$defs/expected_value"
      },
      "description": "Node voltages the checker verifies after the DC solve. Keys are schematic net names (with the leading /sheet/ prefix as they appear in the KiCad-CLI netlist)."
    },
    "ac_sweeps": {
      "type": "object",
      "additionalProperties": { "$ref": "#/$defs/ac_sweep" },
      "description": "Layer-4a small-signal frequency sweeps. Each entry runs ngspice's .ac analysis with a 1V AC source at source_node, layered on top of the DC operating point (source_node's DC bias comes from its power_rails entry if declared, otherwise 0V). The checker parses complex node voltages at the expected frequencies and verifies magnitude (in dB) matches. Use for passive filter cutoff verification, decoupling network resonance checks, EMI filter response. NOT sufficient for regulator loop stability — that needs Layer 4b small-signal switcher models (deferred)."
    },
    "tran_sweeps": {
      "type": "object",
      "additionalProperties": { "$ref": "#/$defs/tran_sweep" },
      "description": "Layer-5a transient time-domain sweeps. Each entry runs ngspice's .tran analysis with an optional step_source (PWL from before_v to after_v at at_time_s) replacing that node's DC rail. The checker samples the time-domain output at named times and verifies voltage matches. Use for RC/RLC step response, inrush current profiles, soft-start ramp verification. Later 5b/c/d (PWM stimulus, XSPICE code models, vendor SPICE, libngspice FFI) deferred."
    }
  },
  "$defs": {
    "ac_sweep": {
      "type": "object",
      "required": ["source_node", "sweep"],
      "additionalProperties": false,
      "properties": {
        "source_node": {
          "type": "string",
          "description": "Schematic net name where the 1V AC signal is injected. May be a power rail (in which case the same voltage source provides DC bias + AC), or a signal-only node (DC bias = 0V, AC = 1V)."
        },
        "sweep": {
          "type": "object",
          "required": ["kind", "start_hz", "stop_hz"],
          "additionalProperties": false,
          "properties": {
            "kind": { "enum": ["decade", "octave", "linear"] },
            "start_hz": { "type": "number", "exclusiveMinimum": 0 },
            "stop_hz":  { "type": "number", "exclusiveMinimum": 0 },
            "points_per_decade": { "type": "integer", "minimum": 1, "default": 10 },
            "n_points": { "type": "integer", "minimum": 2,
              "description": "Only used when kind is 'linear'." }
          }
        },
        "expected": {
          "type": "array",
          "items": { "$ref": "#/$defs/ac_expected_point" },
          "description": "List of (frequency, magnitude_db, tolerance_db) checks. Optionally include an `output_node` per-point; defaults to the sweep-level output_node."
        },
        "output_node": {
          "type": "string",
          "description": "Default node whose magnitude is measured for each expected point. Individual expected points may override with their own output_node."
        }
      }
    },
    "ac_expected_point": {
      "type": "object",
      "required": ["freq_hz", "magnitude_db"],
      "additionalProperties": false,
      "properties": {
        "freq_hz": { "type": "number", "exclusiveMinimum": 0 },
        "magnitude_db": { "type": "number" },
        "tolerance_db": { "type": "number", "minimum": 0, "default": 1 },
        "output_node": { "type": "string" },
        "rationale": { "type": "string" }
      }
    },
    "tran_sweep": {
      "type": "object",
      "required": ["sweep"],
      "additionalProperties": false,
      "properties": {
        "sweep": {
          "type": "object",
          "required": ["step_s", "stop_s"],
          "additionalProperties": false,
          "properties": {
            "step_s": {
              "type": "number", "exclusiveMinimum": 0,
              "description": "Maximum time step (ngspice may adapt smaller). Choose << smallest time constant of interest."
            },
            "stop_s": {
              "type": "number", "exclusiveMinimum": 0,
              "description": "Total simulation time. Choose >> 5τ for typical exponential responses to reach ~99% of final."
            },
            "start_s": {
              "type": "number", "minimum": 0, "default": 0,
              "description": "Optional start-time for output printing (default 0). Simulation still runs from 0 for accuracy."
            }
          }
        },
        "step_source": {
          "type": "object",
          "required": ["node", "before_v", "after_v", "at_time_s"],
          "additionalProperties": false,
          "description": "Applies a PWL step at the given node from before_v to after_v around at_time_s. Overrides any DC voltage source on that node for the tran run. Omit if no explicit stimulus is needed (e.g., using an initial-condition-driven natural response).",
          "properties": {
            "node":       { "type": "string" },
            "before_v":   { "type": "number" },
            "after_v":    { "type": "number" },
            "at_time_s":  { "type": "number", "minimum": 0 },
            "rise_time_s": { "type": "number", "exclusiveMinimum": 0, "default": 1e-9,
              "description": "Transition duration. Default 1 ns for a near-ideal step; longer values model realistic supply ramps." }
          }
        },
        "output_node": {
          "type": "string",
          "description": "Default node whose voltage is sampled at each expected point. Individual expected points may override with their own output_node."
        },
        "expected": {
          "type": "array",
          "items": { "$ref": "#/$defs/tran_expected_point" }
        }
      }
    },
    "tran_expected_point": {
      "type": "object",
      "required": ["time_s", "voltage_v"],
      "additionalProperties": false,
      "properties": {
        "time_s":      { "type": "number", "minimum": 0 },
        "voltage_v":   { "type": "number" },
        "tolerance_v": { "type": "number", "minimum": 0, "default": 0.05 },
        "output_node": { "type": "string" },
        "rationale":   { "type": "string" }
      }
    },
    "expected_value": {
      "type": "object",
      "required": ["v"],
      "additionalProperties": false,
      "properties": {
        "v": {
          "type": "number",
          "description": "Expected node voltage in volts."
        },
        "tolerance_v": {
          "type": "number",
          "minimum": 0,
          "default": 0.05,
          "description": "Absolute tolerance in volts. Actual value within [v - tolerance_v, v + tolerance_v] is a PASS."
        },
        "rationale": { "type": "string" }
      }
    }
  }
}
