{
  "spec_version": "0",
  "name": "op_amp_unity_gain",
  "description": "Unity-gain buffer AC sweep. DC should give VOUT = VIN. AC gain should be ~0 dB across the passband (well below GBW=1 MHz), rolling off above that. Verifies the ac_model → single-pole op-amp subckt path end-to-end.",
  "power_rails": { "VIN": 1.0 },
  "expected": {
    "VOUT": { "v": 1.0, "tolerance_v": 0.01,
              "rationale": "Unity-gain buffer: V(OUT) = V(IN+) with 100 dB DC loop gain; error < V(IN+)/A0 = 10 µV." }
  },
  "ac_sweeps": {
    "buffer_gain": {
      "source_node": "VIN",
      "output_node": "VOUT",
      "sweep": { "kind": "decade", "start_hz": 10, "stop_hz": 10000000, "points_per_decade": 5 },
      "expected": [
        { "freq_hz": 100,      "magnitude_db": 0.0,   "tolerance_db": 0.2,
          "rationale": "Passband: unity-gain feedback, closed-loop bandwidth = GBW = 1 MHz. At 100 Hz we're 4 decades below → gain flat at 0 dB." },
        { "freq_hz": 10000,    "magnitude_db": 0.0,   "tolerance_db": 0.2,
          "rationale": "Still 2 decades below closed-loop bandwidth; gain still flat." },
        { "freq_hz": 1000000,  "magnitude_db": -3.0,  "tolerance_db": 0.5,
          "rationale": "At GBW (=closed-loop bandwidth for a unity-gain buffer), gain crosses -3 dB." }
      ]
    }
  }
}
